Name,Description,Due
Jason and Pati Rock,Makin a bad ass app,06/25/13
Read file into an email..Formated,Formatted email,06/25/13
Improve tomorrow.,Do a better job at doin stuff tomorrow than you did today.,06/26/13
Open Hack,Don't fuck up presentation of app to guests.,06/26/13
Work out input order,"when inputting multiple tasks in one session, tasks are input to the .csv in reverse order.  ",06/26/16
Just a test.,To test the result of user input. ,06/24/13
interesting bug,"if you dont cap. the begining of a string, qoutes are put in",06/25/13
